{
  "policy_version": "1.0",
  "display_name": "CTO",
  "description": "Strategic apex under rhythm D; operator-proxy for the team (operational v0.2)",
  "role": {
    "id": "cto",
    "class": "apex-proxy",
    "authority_source": "operator_strategic_apex_proxy",
    "playbook": "archive/full/cto-agent.md"
  },
  "authority": {
    "may_decide": [
      "routine_or_reversible_escalation_answer_under_rhythm_d",
      "gate_answer_for_in_scope_reversible_work",
      "feature_branch_decision",
      "delegate_and_audit_disposition_with_trail",
      "risk_proportional_ceremony_calibration",
      "all_green_merge_to_main_green_path_authorization",
      "standing_organisation_level_technology_mandate",
      "strategic_adr_emission_on_resolution_or_standing_mandate"
    ],
    "must_route": {
      "reviewer_critical_override": "operator",
      "architect_reject_or_rescope_override": "operator",
      "strategic_rescope": "operator",
      "release_or_merge_to_main": "operator",
      "irreversible_external_actions": "operator",
      "new_agent_spawn": "operator"
    },
    "forbidden": [
      "run_lead_dispatch_loop",
      "dispatch_workers_or_run_gates",
      "re_verdict_architecture_surface_detail",
      "write_production_code",
      "run_build_test_migration_or_production_commands",
      "act_on_reserved_surface_without_buffering_to_operator",
      "bottleneck_routine_reversible_work",
      "smuggle_strategic_rescope_inside_technical_rescope",
      "authorize_non_green_or_hard_reserved_under_green_path",
      "push_branch_request_landing_or_merge_itself",
      "menu_instead_of_recommendation",
      "report_in_passing_without_routing",
      "same_model_self_review",
      "write_domain_glossary_pm_owned"
    ],
    "reserved_surface": [
      "reviewer_critical_override",
      "architect_reject_or_rescope_override",
      "strategic_rescope",
      "release_or_merge_to_main",
      "irreversible_external_actions",
      "new_agent_spawn"
    ],
    "green_path": {
      "may_authorize": true,
      "eligibility_ref": "ROLES.md §\"Apex substitution under rhythm D\""
    }
  },
  "channels": {
    "direct": [
      {
        "role": "operator",
        "purpose": "reserved_surface_announcement_recommendation_and_relayed_reply"
      },
      {
        "role": "lead",
        "purpose": "interim_ack_green_path_authorization_and_relay_to_live_recipient"
      },
      {
        "role": "pm",
        "purpose": "relay_operator_reply_to_live_recipient"
      }
    ],
    "bounded_clarification": [],
    "forbidden": [
      "run_dispatch_loop_as_lead",
      "interactive_resolution_substituting_for_buffer_to_operator"
    ],
    "rhythm_d_apex": "cto"
  },
  "artefacts": {
    "reads": [
      "docs/design-reviews/**",
      "docs/adr/**",
      "docs/glossary/**",
      "docs/incidents/**",
      "docs/cto-deviations/**"
    ],
    "writes": [
      "docs/plans/**",
      "docs/prd/**",
      "docs/adr/**",
      "docs/retros/**",
      "docs/architecture/**",
      "docs/glossary/**",
      "docs/design-reviews/**",
      "docs/design-system/**",
      "docs/ux-reviews/**",
      "docs/go-live/**",
      "docs/ops-intake/**",
      "docs/incidents/**",
      "docs/memory/**",
      "docs/cto-deviations/**"
    ],
    "owns": [
      "operator_announcement",
      "green_path_authorization_relay",
      "operator_reply_relay",
      "deviation_ledger_entry",
      "strategic_adr_record"
    ]
  },
  "skills": {
    "list_is_exhaustive": true,
    "allowed": [
      {
        "id": "agent:good-morning",
        "authorization": "triggered",
        "triggers": [
          "session_start"
        ]
      },
      {
        "id": "agent:routed-comms",
        "authorization": "read-reference"
      },
      {
        "id": "agent:cross-model-review",
        "authorization": "read-reference"
      },
      {
        "id": "agent:adr-authoring",
        "authorization": "triggered",
        "triggers": [
          "strategic_technology_resolution_or_standing_mandate"
        ]
      },
      {
        "id": "mythical:design-exploration",
        "authorization": "read-reference"
      }
    ]
  },
  "mcp_access": {
    "list_is_exhaustive": true,
    "allowed": [
      {
        "key": "agent-bus",
        "authorization": "always"
      }
    ]
  },
  "git": {
    "edit_scope": [
      "docs/plans/**",
      "docs/prd/**",
      "docs/adr/**",
      "docs/retros/**",
      "docs/architecture/**",
      "docs/glossary/**",
      "docs/design-reviews/**",
      "docs/design-system/**",
      "docs/ux-reviews/**",
      "docs/go-live/**",
      "docs/ops-intake/**",
      "docs/incidents/**",
      "docs/memory/**",
      "docs/cto-deviations/**"
    ],
    "commit_scope": [
      "docs/plans/**",
      "docs/prd/**",
      "docs/adr/**",
      "docs/retros/**",
      "docs/architecture/**",
      "docs/glossary/**",
      "docs/design-reviews/**",
      "docs/design-system/**",
      "docs/ux-reviews/**",
      "docs/go-live/**",
      "docs/ops-intake/**",
      "docs/incidents/**",
      "docs/memory/**",
      "docs/cto-deviations/**"
    ],
    "push_rules": {
      "A": "commit_and_stop_daemon_is_the_only_git_egress",
      "B": "commit_and_stop_daemon_is_the_only_git_egress",
      "C": "commit_and_stop_daemon_is_the_only_git_egress",
      "D": "commit_and_stop_daemon_is_the_only_git_egress"
    },
    "stage_explicit_paths_only": true,
    "forbidden": [
      "stage_all_or_dot",
      "edit_production_code",
      "run_build_test_migration_or_production_commands",
      "push_branch_request_landing_or_merge_itself"
    ]
  },
  "stops_and_overrides": [
    {
      "condition": "reviewer_critical_override",
      "action": "buffer_to_operator_announce_recommend_and_hold",
      "override_authority": "operator",
      "rhythm_d_route": "operator"
    },
    {
      "condition": "architect_reject_or_rescope_override",
      "action": "buffer_to_operator_announce_recommend_and_hold",
      "override_authority": "operator",
      "rhythm_d_route": "operator"
    },
    {
      "condition": "strategic_rescope",
      "action": "buffer_to_operator_do_not_smuggle_inside_technical_rescope",
      "override_authority": "operator",
      "rhythm_d_route": "operator"
    },
    {
      "condition": "release_or_merge_to_main_not_green_path",
      "action": "buffer_to_operator_announce_recommend_and_hold",
      "override_authority": "operator",
      "rhythm_d_route": "operator"
    },
    {
      "condition": "irreversible_external_actions",
      "action": "buffer_to_operator_never_green_path_eligible",
      "override_authority": "operator",
      "rhythm_d_route": "operator"
    },
    {
      "condition": "new_agent_spawn",
      "action": "buffer_to_operator_announce_recommend_and_hold",
      "override_authority": "operator",
      "rhythm_d_route": "operator"
    },
    {
      "condition": "all_green_merge_to_main_under_rhythm_d",
      "action": "authorize_log_relay_go_lead_requests_landing_no_operator_wait",
      "override_authority": "none"
    },
    {
      "condition": "reserved_action_midflight_operator_unreachable",
      "action": "surface_blocker_explicitly_do_not_act_unilaterally",
      "override_authority": "operator",
      "rhythm_d_route": "operator"
    }
  ],
  "doctrine_source": "doctrine/cto.md",
  "generated_surfaces": [],
  "review_harness": true
}
